{
  "schemaVersion": "1.0",
  "algorithmVersion": "1.1.2",
  "clientMeasurementId": "3f2b8c1e-7a4d-4e0b-9c55-1d2e3f4a5b6c",
  "timestamp": "2026-10-03T09:15:30.250Z",
  "mode": "OBJECT_BOX",
  "unit": "METRE",
  "dimensions": {
    "lengthM": { "value": 0.602, "sigmaM": 0.004, "ci95M": 0.008 },
    "widthM": { "value": 0.401, "sigmaM": 0.004, "ci95M": 0.008 },
    "heightM": { "value": 0.298, "sigmaM": 0.003, "ci95M": 0.006 }
  },
  "confidence": 0.87,
  "state": "STABLE",
  "qualityFlags": ["PARTIAL_VIEW"],
  "depthTier": "A",
  "depthSource": "LIDAR",
  "obb": {
    "centerWorld": [0.12, 0.149, -0.85],
    "halfExtentsM": [0.301, 0.1995, 0.149],
    "yawRad": 0.35,
    "supportPlaneY": 0.0
  },
  "overlay": {
    "cornersWorld": [[0,0,0],[1,0,0],[1,1,0],[0,1,0],[0,0,1],[1,0,1],[1,1,1],[0,1,1]],
    "cornersScreen": [[10,10],[20,10],[20,20],[10,20],[12,12],[22,12],[22,22],[12,22]],
    "edges": [[0,1],[1,2],[2,3],[3,0],[4,5],[5,6],[6,7],[7,4],[0,4],[1,5],[2,6],[3,7]],
    "keypoints": [
      { "name": "corner0", "world": [0.1, 0.0, -0.9], "screen": [101.5, 220.25], "sigma": 0.004 }
    ],
    "labelAnchorScreen": [150, 120]
  },
  "frameOfReference": {
    "convention": "Y_UP_RIGHT_HANDED",
    "worldOriginId": "arkit-origin-1",
    "worldOriginEpoch": 2,
    "sessionId": "b1d0a2c4-5e6f-4a7b-8c9d-0e1f2a3b4c5d"
  },
  "scaleSource": "SENSOR_METRIC_LIDAR",
  "trust": "UNVERIFIED_ESTIMATE",
  "device": { "model": "iPhone15,3", "os": "iOS 18.2", "kitVersion": "1.1.0" }
}
