{
  "schemaVersion": "1.0",
  "algorithmVersion": "1.1.2",
  "clientMeasurementId": "9a8b7c6d-5e4f-4a3b-8c2d-1e0f9a8b7c6d",
  "timestamp": "2026-10-03T09:16:00Z",
  "mode": "POINT_TO_POINT",
  "unit": "METRE",
  "dimensions": { "distanceM": { "value": 1.204, "sigmaM": 0.006, "ci95M": 0.012 } },
  "geometry": { "endpointsWorld": [[0.1, 0.9, -1.2], [1.3, 0.9, -1.2]] },
  "confidence": 0.55,
  "state": "TRACKING",
  "qualityFlags": [],
  "depthTier": "B",
  "depthSource": "DEPTH_FROM_MOTION",
  "frameOfReference": {
    "convention": "Y_UP_RIGHT_HANDED",
    "worldOriginEpoch": 0,
    "sessionId": "b1d0a2c4-5e6f-4a7b-8c9d-0e1f2a3b4c5d"
  },
  "scaleSource": "VIO_METRIC",
  "device": { "model": "Pixel 7a", "os": "Android 14", "kitVersion": "1.1.0" }
}
