{
  "schemaVersion": "1.0",
  "algorithmVersion": "1.1.2",
  "clientMeasurementId": "5c4d3e2f-1a0b-4c9d-8e7f-6a5b4c3d2e1f",
  "timestamp": "2026-10-03T09:17:10Z",
  "mode": "PLANE_DISTANCE",
  "unit": "METRE",
  "dimensions": { "distanceM": { "value": 0.873, "sigmaM": 0.005, "ci95M": 0.01 } },
  "geometry": { "plane": { "normalWorld": [0, 1, 0], "offsetM": 0.0 } },
  "confidence": 0.8,
  "state": "STABLE",
  "qualityFlags": [],
  "depthTier": "A",
  "depthSource": "LIDAR",
  "frameOfReference": {
    "convention": "Y_UP_RIGHT_HANDED",
    "worldOriginEpoch": 1,
    "sessionId": "b1d0a2c4-5e6f-4a7b-8c9d-0e1f2a3b4c5d"
  },
  "scaleSource": "SENSOR_METRIC_LIDAR",
  "device": { "model": "iPhone15,3", "os": "iOS 18.2", "kitVersion": "1.1.0" }
}
